{
  "version": "1.0.0",
  "status": "DRAFT",
  "principle": "ONE_FEATURE_MODEL_MUST_BE_EXPLAINABLE_ACROSS_FEATURE_DB_API_PAYLOAD_CODE_AND_EVIDENCE",
  "systems": {
    "feature": "BLUEPRINT",
    "database": "DATA_AND_PERSISTENCE",
    "api": "API_CONTRACT",
    "payload": "PAYLOAD_CAPABILITY_AND_CONFIGURATION",
    "code": "IMPLEMENTATION",
    "evidence": "TEST_AND_EVIDENCE"
  },
  "alignmentStates": [
    "MATCH",
    "MAPPED",
    "MISSING",
    "EXTRA",
    "DRIFT",
    "CONFLICT",
    "DUPLICATE",
    "UNRESOLVED",
    "BLOCKED"
  ],
  "rules": {
    "noInference": true,
    "noSilentFeature": true,
    "noUnmappedPersistence": true,
    "noUnmappedApi": true,
    "noUnownedImplementation": true,
    "evidenceRequiredForGreen": true,
    "payloadOriginMustBeExplicit": true
  }
}
